"Title","Author","Text","Categories","","","","","","",""
"Creating Custom Views in Android","Mustafa Zukic","The Android platform offers a large range of user interface widgets that are sufficient for the needs of most applications. These widgets are great and certainly provide us with functional and appealing end products, but sometimes us software developers like to think outside of the box and develop our own custom interfaces. ","Android Dev","","","","","","",""
"Serializing Your Object In Flutter","tomerpacific","If you intend to save user data to the shared preferences or local storage in your Flutter application, you will need to serialize it manually. This is because both methods only support a limited selection of primitive object types and your object will probably not fall into any category. To do this we will be using the dart:convert decoder with its jsonEncode/jsonDecode methods, so make sure to import it into your project.","Android Dev","","","","","","",""
"Decode Scaffold","Greg Perry","The Scaffold widget implements the basic Material Design visual layout for your app. As such, it provides a means for showing drawers, snack bars, and bottom sheets. As of this writing, it’s involved in implementing, six elements defined in the Material Design.","Android Dev","","","","","","",""
"Considerations While Using Kotlin","aeqdigital","Navigating the land of Android development can be daunting, especially with the framework changing drastically in the last five years. ","Android Dev","","","","","","",""
"Create a simple Tic Tac Toe app in Flutter","Sayan Mondal","This is an amazing start for all the beginners in Flutter as this is something I call like a step into the intermediate world of Flutter development. After making this project you’d definitely feel more confident and have a better grip on the fundamentals…","Android Dev","","","","","","",""
"Android Automated Testing Setup","Robert Konarskis","Since the recent release of Robolectric with support for the AndroidX testing framework, writing automated tests for Android has become less of a burden. Now that the tools have matured enough, I believe it is the right time to start testing your Android codebase if you haven’t already.","Android Dev","","","","","","",""
"Machine Learning in Android using Firebase ML Kit","Ayusch Jain","Back in the days, using machine learning capabilities was only possible over the cloud as it required a lot of compute power, high-end hardware etc… But mobile devices nowadays have become much more powerful and our Algorithms more efficient. All this has led to on-device…","Android Dev","","","","","","",""
